{"schema_version":"aegisrt.experiment.fault-kernel-workload/v1","workload_version":"f4-deterministic-agent-tree-v1","fixture_protocol":"aegisbench-fault-kernel-agent-v1","profile":"smoke","plan_id":"f4-daemon-sigkill-cgroup-smoke-v1","case_id":"F4-kernel-smoke","runtime_config":{"scheduler_policy":"dag-drcfs","capacity":{"cpu_milli":1000,"memory_mib":512,"llm_slots":0,"token_budget":4096},"max_workers":2,"poll_interval_ms":10,"event_capacity":128,"pids_max":64,"cpu_period_micros":100000,"shutdown_timeout_ms":5000,"agent_timeout_ms":15000,"task_timeout_ms":20000,"target_hold_ms":5000,"spawn_child":true},"agents":[{"id":"f4-target-agent","fixture_role":"target-agent-tree","resources":{"cpu_milli":100,"memory_mib":64,"llm_slots":0,"token_budget":256},"max_concurrency":1,"execution_timeout_ms":15000},{"id":"f4-survivor-agent","fixture_role":"survivor","resources":{"cpu_milli":100,"memory_mib":64,"llm_slots":0,"token_budget":256},"max_concurrency":1,"execution_timeout_ms":15000}],"cells":[{"phase":"measurement","seed":104729,"repetition":0,"pair_id":"f4-m-104729-0","target":{"id":"f4-m-104729-0-target","workflow_id":"f4-m-104729-0-workflow","agent_id":"f4-target-agent","goal":"execute deterministic F4 fixture","dependencies":[],"priority":1,"resources":{"cpu_milli":100,"memory_mib":64,"llm_slots":0,"token_budget":256},"max_attempts":2,"timeout_ms":20000,"idempotency_key":"f4-m-104729-0-target-key"},"survivor":{"id":"f4-m-104729-0-survivor","workflow_id":"f4-m-104729-0-workflow","agent_id":"f4-survivor-agent","goal":"execute deterministic F4 fixture","dependencies":[],"priority":10,"resources":{"cpu_milli":100,"memory_mib":64,"llm_slots":0,"token_budget":256},"max_attempts":1,"timeout_ms":20000,"idempotency_key":"f4-m-104729-0-survivor-key"}},{"phase":"measurement","seed":104743,"repetition":0,"pair_id":"f4-m-104743-0","target":{"id":"f4-m-104743-0-target","workflow_id":"f4-m-104743-0-workflow","agent_id":"f4-target-agent","goal":"execute deterministic F4 fixture","dependencies":[],"priority":1,"resources":{"cpu_milli":100,"memory_mib":64,"llm_slots":0,"token_budget":256},"max_attempts":2,"timeout_ms":20000,"idempotency_key":"f4-m-104743-0-target-key"},"survivor":{"id":"f4-m-104743-0-survivor","workflow_id":"f4-m-104743-0-workflow","agent_id":"f4-survivor-agent","goal":"execute deterministic F4 fixture","dependencies":[],"priority":10,"resources":{"cpu_milli":100,"memory_mib":64,"llm_slots":0,"token_budget":256},"max_attempts":1,"timeout_ms":20000,"idempotency_key":"f4-m-104743-0-survivor-key"}}]}